{"schema":"mana.inspect.source/v1","source":{"path":"src/PaymentService.java","availability":"present"},"relations":[{"relation_type":"references-source/v1","artifact_id":"journey-record:anc_000000000000000000000000","journey_id":"jrn_000000000000000000000000","anchor_id":"anc_000000000000000000000000","source":{"path":"src/PaymentService.java","revision":"bbbbbbbbbbbbbbbbbbbbbbbbbbbbbbbbbbbbbbbb","range":{"start_line":1,"end_line":2}},"staleness":"stale"}],"coverage":"explicit_journey_anchors","guarantees":{"model_calls":0,"writes":false,"relation_coverage":"explicit_structured_only"},"diagnostics":[]}
